Sentence,Left,Right,Relation,Source
What's the best way to polish aluminum or metal?,aluminum,metal,<,Web
"When the sea freezes from October to April, resupplying materials offshore is difficult because it requires the use of icebreakers, and there is a safety hazard in getting people off the rig in case of a fire or accident.",fire,accident,<,NYT_ENG_20020307.0408
When their resignation is accepted they become an emeritus archbishop or bishop.,archbishop,bishop,<,Web
"When used properly, finite insurance allows insurers or corporations to spread their risk of loss on an asset or business over time and also spread it to other insurers willing to take on more risk in exchange for premiums.",asset,business,>,NYT_ENG_20050309.0011
"While this report is not a recommendation or endorsement by the Georgia Environmental Protection Division or its management contractor, it is ``an information source to help vehicle owners locate repair facilities conducting emission-related repairs.''",recommendation,endorsement,>,NYT_ENG_19990720.0076
Why are you recommending angioplasty or surgery for me?,angioplasty,surgery,<,Web
Will the Celtics ever again be a passion or obsession for the masses?,passion,obsession,>,NYT_ENG_20051213.0082
"William Cross, a freelance writer in Montclair, N.J., used a buying service, often called an agent or broker, to buy his Chrysler Town & Country mini-van.",agent,broker,>,NYT_ENG_19970313.0629
"You and your grandchild can share an interest or hobby, or you may want to encourage one of his or hers.",interest,hobby,>,NYT_ENG_19970801.0560
"You get the piano, but you won't be in much of a mood or condition to play it.",mood,condition,<,NYT_ENG_20061112.0122
"You will need fresh masa, a heavy tortilla press, a comal or griddle and plastic wrap.",comal,griddle,<,NYT_ENG_19991130.0166
Pins about Paris or France hand-picked by Pinner Hope Jordan,Paris,France,<,Web
The nuptials will take place in either France or Paris.,France,Paris,>,Web
Stanford of the twenty-first century is not about addressing the particular challenges facing California or America,California,America,<,Web
The attitude of the new colony was never as open as that of America or California ,America,California,>,Web
No trip to Beijing or China is complete without visiting the Great Wall. ,Beijing,China,<,Web
If you are planning on spending any time in China or Beijing this book is a required read because it effectively captures the spirit of China today.,China,Beijing,>,Web
No vaccinations are needed for Berlin or Germany. ,Berlin,Germany,<,Web
"Moabit is mentioned in countless books and films taking place in Germany or Berlin, primarily in reference to criminal court cases or incarcerations at the Central Criminal Court (Kriminalgericht) and detention centre.",Germany,Berlin,>,Web
Ghana defender John Pantsil says he will not hesitate to join a club in Russia or Asia.,Russia,Asia,&,Web